{
  "$schema": "run-set.schema.json",
  "schema_version": "1.0",
  "observed_through": "2026-08-25",
  "platform": {
    "id": "nvidia-dgx-spark-gb10-128gb",
    "display_name": "NVIDIA DGX Spark",
    "accelerator": "GB10",
    "accelerator_count": 1,
    "memory_gib": 128
  },
  "comparison_groups": {
    "dgx-spark-quick-2026-08-21": {
      "label": "OpenAI-compatible Quick benchmark · 2026-08-21",
      "classification": "quick",
      "comparison_level": "directional",
      "workload": "DGX Spark localhost에서 256-token synthetic repeated-token output, streaming sample 3회, concurrency 2 closed-loop request 4건 및 deterministic Tool schema를 사용",
      "limitations": [
        "단일 Quick run 결과이며 신뢰구간과 지속 부하 구간을 포함하지 않습니다.",
        "반복 토큰 출력은 speculative decoding에 유리한 workload입니다.",
        "Qwen3.6은 vLLM 0.24.0, 신규 후보는 vLLM 0.27.1을 사용했으므로 런타임이 통제된 비교가 아닙니다.",
        "SGLang DSpark와 DFlash2의 closed-loop 요청은 생성 token 수와 finish reason이 달라 aggregate throughput 순위에서 제외했습니다.",
        "DFlash2 custom image의 초기 66.755 decode tok/s는 canonical 재측정에서 재현되지 않았습니다.",
        "답변 품질, 한국어 답변 품질, open-loop goodput 및 application workflow는 측정하지 않았습니다."
      ]
    },
    "dgx-spark-gemma4-sequential-quick-2026-08": {
      "label": "Gemma4 sequential-output Quick benchmark · 2026-08",
      "classification": "quick",
      "comparison_level": "directional",
      "workload": "DGX Spark localhost에서 sequential-integer 256-token output, streaming sample 3회, concurrency 2 closed-loop request 4건 및 deterministic Tool schema를 사용",
      "limitations": [
        "기존 vLLM 후보의 repeated-word workload와 출력 프롬프트가 달라 직접 비교할 수 없습니다.",
        "단일 Quick run 결과이며 신뢰구간과 지속 부하 구간을 포함하지 않습니다.",
        "Ollama와 vLLM은 런타임, 양자화 형식 및 요청 호환 옵션이 달라 결과는 serving stack의 방향성 비교입니다.",
        "Ollama는 chat_template_kwargs를 전송하지 않았고 vLLM은 enable_thinking=false를 전송했습니다.",
        "답변 품질, 한국어 답변 품질, open-loop goodput 및 application workflow는 측정하지 않았습니다."
      ]
    },
    "dgx-spark-historical-smoke-2026-05-01": {
      "label": "Gemma4 BF16 API smoke (과거 측정) · 2026-05-01",
      "classification": "smoke",
      "comparison_level": "not_comparable",
      "workload": "장시간 실행 중인 Gemma4 BF16 서비스에 non-streaming 160-token chat request 1건을 요청",
      "limitations": [
        "현재 Quick benchmark와 workload, context length, concurrency 및 co-located memory 조건이 다릅니다.",
        "기록된 generation throughput은 server log snapshot이며 현재 Quick benchmark의 client metric과 직접 비교할 수 없습니다."
      ]
    }
  },
  "runs": [
    {
      "id": "20260821-nemotron35-nvfp4-dspark-n3",
      "observed_on": "2026-08-21",
      "comparison_group": "dgx-spark-quick-2026-08-21",
      "status": "pass",
      "promotion": "advance",
      "eligible_for_ranking": true,
      "model": {
        "display_name": "Nemotron 3.5 Lightning 30B-A3B",
        "family": "Nemotron 3.5",
        "architecture": "hybrid-moe",
        "total_parameters_b": 30,
        "active_parameters_b": 3
      },
      "artifact": {
        "publisher": "NVIDIA",
        "model_id": "nvidia/NVIDIA-Nemotron-3.5-Lightning-30B-A3B-NVFP4",
        "revision": "e8f3c7c4de75ad84fe1bcef95d38eca76214480b",
        "quantization": "ModelOpt NVFP4 target + NVFP4 DSpark draft",
        "license": "OpenMDW License Agreement 1.1",
        "commercial_use": "allowed"
      },
      "serving": {
        "engine": "vLLM",
        "version": "0.27.1",
        "image": "vllm/vllm-openai:v0.27.1-ubuntu2404",
        "image_digest": "sha256:6a278041c910af1a6db0f3555aac30dbdf93d7acb01008656d99007cf7781a3a",
        "profile": "nemotron35-nvfp4-candidate",
        "options": {
          "tensor_parallel_size": 1,
          "max_model_len": 32768,
          "max_num_seqs": 2,
          "max_num_batched_tokens": 8192,
          "gpu_memory_utilization": 0.4,
          "kv_cache_dtype": "fp8",
          "moe_backend": "marlin",
          "mamba_backend": "flashinfer/align",
          "prefix_caching": true,
          "chunked_prefill": true,
          "tool_call_parser": "qwen3_coder",
          "reasoning_parser": "nemotron_v3"
        },
        "speculative": {
          "mode": "external-draft",
          "draft_model": "nvidia/NVIDIA-Nemotron-3.5-Lightning-30B-A3B-NVFP4-DSpark@d10c6ff40d6e69d1f92e407e027de3eafdb77645",
          "num_tokens": 3,
          "acceptance_pct": 99.43
        }
      },
      "validation": {
        "api": "pass",
        "chat": "pass",
        "tool_simple": {
          "passed": 6,
          "attempts": 6
        },
        "tool_nested": {
          "passed": 6,
          "attempts": 6
        },
        "tool_large_surface": {
          "passed": 6,
          "attempts": 6
        },
        "answer_quality": "not_run"
      },
      "metrics": {
        "ttft_p50_ms": 147,
        "ttft_p95_ms": 213,
        "tpot_p50_ms": 7.253,
        "e2e_p50_s": 2.001,
        "single_user_decode_tps_p50": 137.874,
        "aggregate_output_tps": 221.477,
        "concurrency": 2,
        "request_throughput_rps": 0.865,
        "accelerator_process_memory_mib": 47781,
        "host_available_memory_gib": 58
      },
      "notes": [
        "측정 가능한 후보 중 Quick benchmark 성능이 가장 높았습니다.",
        "모델 카드의 지원 언어 목록에 한국어가 포함되지 않아 한국어 답변 품질 검증이 필요합니다.",
        "Synthetic output에서 draft acceptance가 비정상적으로 높게 관측되었습니다."
      ],
      "provenance": {
        "measurement_scope": "DGX Spark localhost에서 OpenAI-compatible quick_check.py로 측정",
        "source_record_sha256": "ea5bb20cb7aa000e0eaa7e47465b807d3ed271ff0a6d6f0bbb06547c651f089a"
      }
    },
    {
      "id": "20260821-qwen36-nvfp4-mtp-n3",
      "observed_on": "2026-08-21",
      "comparison_group": "dgx-spark-quick-2026-08-21",
      "status": "pass",
      "promotion": "control",
      "eligible_for_ranking": true,
      "model": {
        "display_name": "Qwen3.6 35B-A3B",
        "family": "Qwen3.6",
        "architecture": "moe",
        "total_parameters_b": 35,
        "active_parameters_b": 3
      },
      "artifact": {
        "publisher": "NVIDIA",
        "model_id": "nvidia/Qwen3.6-35B-A3B-NVFP4",
        "revision": "491c2f1ea524c639598bf8fa787a93fed5a6fbce",
        "quantization": "ModelOpt NVFP4, Marlin weight-only FP4 path",
        "license": "실행 기록에 미기재",
        "commercial_use": "not_recorded"
      },
      "serving": {
        "engine": "vLLM",
        "version": "0.24.0",
        "image": "vllm/vllm-openai:v0.24.0-ubuntu2404",
        "image_digest": "sha256:bfdefe75b5c3fb83f4f0fcaae8f39fac87941cbadb05cd2203f44a1689236c71",
        "profile": "qwen36-nvfp4-mtp",
        "options": {
          "tensor_parallel_size": 1,
          "max_model_len": 32768,
          "max_num_seqs": 2,
          "max_num_batched_tokens": 8192,
          "gpu_memory_utilization": 0.4,
          "kv_cache_dtype": "fp8",
          "attention_backend": "flashinfer",
          "moe_backend": "marlin",
          "prefix_caching": true,
          "chunked_prefill": true,
          "async_scheduling": true,
          "tool_call_parser": "qwen3_xml",
          "reasoning_parser": "qwen3",
          "thinking": false
        },
        "speculative": {
          "mode": "mtp",
          "draft_model": null,
          "num_tokens": 3,
          "acceptance_pct": 99.48
        }
      },
      "validation": {
        "api": "pass",
        "chat": "pass",
        "tool_simple": {
          "passed": 6,
          "attempts": 6
        },
        "tool_nested": {
          "passed": 6,
          "attempts": 6
        },
        "tool_large_surface": {
          "passed": 6,
          "attempts": 6
        },
        "answer_quality": "not_run"
      },
      "metrics": {
        "ttft_p50_ms": 182,
        "ttft_p95_ms": null,
        "tpot_p50_ms": 10.119,
        "e2e_p50_s": 2.761,
        "single_user_decode_tps_p50": 98.828,
        "aggregate_output_tps": 98.453,
        "concurrency": 2,
        "request_throughput_rps": 0.385,
        "accelerator_process_memory_mib": 71038,
        "host_available_memory_gib": 36
      },
      "notes": [
        "후속 benchmark의 비교 기준입니다.",
        "MTP는 synthetic decode 성능을 높였지만 accelerator memory allocation을 약 23 GiB 증가시켰습니다.",
        "Synthetic output에서 draft acceptance가 비정상적으로 높게 관측되었습니다."
      ],
      "provenance": {
        "measurement_scope": "DGX Spark localhost에서 OpenAI-compatible quick_check.py로 측정",
        "source_record_sha256": "924a3038cea5116e9ac97ab3898f3ef74f9d14a7bfb1412298e3f0e311268170"
      }
    },
    {
      "id": "20260821-qwen36-nvfp4-mtp-off",
      "observed_on": "2026-08-21",
      "comparison_group": "dgx-spark-quick-2026-08-21",
      "status": "pass",
      "promotion": "control",
      "eligible_for_ranking": true,
      "model": {
        "display_name": "Qwen3.6 35B-A3B",
        "family": "Qwen3.6",
        "architecture": "moe",
        "total_parameters_b": 35,
        "active_parameters_b": 3
      },
      "artifact": {
        "publisher": "NVIDIA",
        "model_id": "nvidia/Qwen3.6-35B-A3B-NVFP4",
        "revision": "491c2f1ea524c639598bf8fa787a93fed5a6fbce",
        "quantization": "ModelOpt NVFP4, Marlin weight-only FP4 path",
        "license": "실행 기록에 미기재",
        "commercial_use": "not_recorded"
      },
      "serving": {
        "engine": "vLLM",
        "version": "0.24.0",
        "image": "vllm/vllm-openai:v0.24.0-ubuntu2404",
        "image_digest": "sha256:bfdefe75b5c3fb83f4f0fcaae8f39fac87941cbadb05cd2203f44a1689236c71",
        "profile": "qwen36-nvfp4",
        "options": {
          "tensor_parallel_size": 1,
          "max_model_len": 32768,
          "max_num_seqs": 2,
          "max_num_batched_tokens": 8192,
          "gpu_memory_utilization": 0.4,
          "kv_cache_dtype": "fp8",
          "attention_backend": "flashinfer",
          "moe_backend": "marlin",
          "prefix_caching": true,
          "chunked_prefill": true,
          "async_scheduling": true,
          "tool_call_parser": "qwen3_xml",
          "reasoning_parser": "qwen3",